{
  "t": "files",
  "seq": 10,
  "town_id": "twn_01926f3a-0000-7000-8000-000000000001",
  "at": "2026-10-10T14:03:11.452Z",
  "event": "file.state",
  "file_id": "fil_01926f3a-0000-7000-8000-000000000001",
  "state": "clean",
  "verdict": "clean",
  "name": "report.xml",
  "bytes": 2048,
  "uploader": "res_01926f3a-0000-7000-8000-000000000001"
}
